[
  {
    "category": "summon_definition",
    "id": "mini_wraith",
    "schema_version": 1,
    "name_key": "SUMMON_MINI_WRAITH_NAME",
    "description_key": "SUMMON_MINI_WRAITH_DESC",
    "availability": [
      "LAUNCH",
      "EXPANSION"
    ],
    "tags": [
      "summon",
      "nonrecursive"
    ],
    "compatibility": {
      "floor_ids": [
        "floor_ruins_of_remnant",
        "floor_void_forest",
        "floor_time_rift",
        "floor_plane_forge",
        "floor_throne_of_void"
      ],
      "actor_kinds": [
        "summon"
      ]
    },
    "references": [
      "ruins_wraith"
    ],
    "runtime_kind": "mini_wraith",
    "parent_definition_id": "ruins_wraith",
    "max_hp": 25,
    "hp_fraction": 0,
    "damage": 10,
    "damage_multiplier": 1,
    "move_speed": 80,
    "collision_radius_px": 7,
    "lifetime_frames": 480,
    "spawn_warning_frames": 30,
    "attack_warning_frames": 30,
    "final_explosion_warning_frames": 35,
    "reward_eligible": false,
    "capabilities": [],
    "attack": {
      "kind": "melee",
      "range_px": 32,
      "active_frames": 6,
      "recovery_frames": 20,
      "cooldown_frames": 120
    }
  },
  {
    "category": "summon_definition",
    "id": "small_void_spore",
    "schema_version": 1,
    "name_key": "SUMMON_SMALL_VOID_SPORE_NAME",
    "description_key": "SUMMON_SMALL_VOID_SPORE_DESC",
    "availability": [
      "LAUNCH",
      "EXPANSION"
    ],
    "tags": [
      "summon",
      "nonrecursive"
    ],
    "compatibility": {
      "floor_ids": [
        "floor_ruins_of_remnant",
        "floor_void_forest",
        "floor_time_rift",
        "floor_plane_forge",
        "floor_throne_of_void"
      ],
      "actor_kinds": [
        "summon"
      ]
    },
    "references": [
      "void_spore"
    ],
    "runtime_kind": "small_void_spore",
    "parent_definition_id": "void_spore",
    "max_hp": 12,
    "hp_fraction": 0,
    "damage": 6,
    "damage_multiplier": 1,
    "move_speed": 42,
    "collision_radius_px": 6,
    "lifetime_frames": 480,
    "spawn_warning_frames": 30,
    "attack_warning_frames": 30,
    "final_explosion_warning_frames": 35,
    "reward_eligible": false,
    "capabilities": [],
    "attack": {
      "kind": "melee",
      "range_px": 40,
      "active_frames": 6,
      "recovery_frames": 20,
      "cooldown_frames": 120
    }
  },
  {
    "category": "summon_definition",
    "id": "void_firefly",
    "schema_version": 1,
    "name_key": "SUMMON_VOID_FIREFLY_NAME",
    "description_key": "SUMMON_VOID_FIREFLY_DESC",
    "availability": [
      "LAUNCH",
      "EXPANSION"
    ],
    "tags": [
      "summon",
      "nonrecursive"
    ],
    "compatibility": {
      "floor_ids": [
        "floor_ruins_of_remnant",
        "floor_void_forest",
        "floor_time_rift",
        "floor_plane_forge",
        "floor_throne_of_void"
      ],
      "actor_kinds": [
        "summon"
      ]
    },
    "references": [
      "forest_caller"
    ],
    "runtime_kind": "void_firefly",
    "parent_definition_id": "forest_caller",
    "max_hp": 20,
    "hp_fraction": 0,
    "damage": 6,
    "damage_multiplier": 1,
    "move_speed": 96,
    "collision_radius_px": 6,
    "lifetime_frames": 900,
    "spawn_warning_frames": 30,
    "attack_warning_frames": 30,
    "final_explosion_warning_frames": 35,
    "reward_eligible": false,
    "capabilities": [],
    "attack": {
      "kind": "projectile_volley",
      "range_px": 96,
      "active_frames": 6,
      "recovery_frames": 20,
      "cooldown_frames": 120
    }
  },
  {
    "category": "summon_definition",
    "id": "void_beetle",
    "schema_version": 1,
    "name_key": "SUMMON_VOID_BEETLE_NAME",
    "description_key": "SUMMON_VOID_BEETLE_DESC",
    "availability": [
      "LAUNCH",
      "EXPANSION"
    ],
    "tags": [
      "summon",
      "nonrecursive"
    ],
    "compatibility": {
      "floor_ids": [
        "floor_ruins_of_remnant",
        "floor_void_forest",
        "floor_time_rift",
        "floor_plane_forge",
        "floor_throne_of_void"
      ],
      "actor_kinds": [
        "summon"
      ]
    },
    "references": [
      "stone_shell_strider"
    ],
    "runtime_kind": "void_beetle",
    "parent_definition_id": "stone_shell_strider",
    "max_hp": 80,
    "hp_fraction": 0,
    "damage": 18,
    "damage_multiplier": 1,
    "move_speed": 72,
    "collision_radius_px": 10,
    "lifetime_frames": 1200,
    "spawn_warning_frames": 30,
    "attack_warning_frames": 30,
    "final_explosion_warning_frames": 35,
    "reward_eligible": false,
    "capabilities": [],
    "attack": {
      "kind": "charge",
      "range_px": 48,
      "active_frames": 6,
      "recovery_frames": 20,
      "cooldown_frames": 120
    }
  },
  {
    "category": "summon_definition",
    "id": "hunter_echo",
    "schema_version": 1,
    "name_key": "SUMMON_HUNTER_ECHO_NAME",
    "description_key": "SUMMON_HUNTER_ECHO_DESC",
    "availability": [
      "LAUNCH",
      "EXPANSION"
    ],
    "tags": [
      "summon",
      "nonrecursive"
    ],
    "compatibility": {
      "floor_ids": [
        "floor_ruins_of_remnant",
        "floor_void_forest",
        "floor_time_rift",
        "floor_plane_forge",
        "floor_throne_of_void"
      ],
      "actor_kinds": [
        "summon"
      ]
    },
    "references": [
      "void_hunter"
    ],
    "runtime_kind": "hunter_echo",
    "parent_definition_id": "void_hunter",
    "max_hp": 45,
    "hp_fraction": 0,
    "damage": 7,
    "damage_multiplier": 1,
    "move_speed": 126,
    "collision_radius_px": 8,
    "lifetime_frames": 480,
    "spawn_warning_frames": 30,
    "attack_warning_frames": 30,
    "final_explosion_warning_frames": 35,
    "reward_eligible": false,
    "capabilities": [],
    "attack": {
      "kind": "melee",
      "range_px": 24,
      "active_frames": 6,
      "recovery_frames": 20,
      "cooldown_frames": 120
    }
  },
  {
    "category": "summon_definition",
    "id": "ranger_echo",
    "schema_version": 1,
    "name_key": "SUMMON_RANGER_ECHO_NAME",
    "description_key": "SUMMON_RANGER_ECHO_DESC",
    "availability": [
      "LAUNCH",
      "EXPANSION"
    ],
    "tags": [
      "summon",
      "nonrecursive"
    ],
    "compatibility": {
      "floor_ids": [
        "floor_ruins_of_remnant",
        "floor_void_forest",
        "floor_time_rift",
        "floor_plane_forge",
        "floor_throne_of_void"
      ],
      "actor_kinds": [
        "summon"
      ]
    },
    "references": [
      "phase_ranger"
    ],
    "runtime_kind": "ranger_echo",
    "parent_definition_id": "phase_ranger",
    "max_hp": 42,
    "hp_fraction": 0,
    "damage": 11,
    "damage_multiplier": 1,
    "move_speed": 84,
    "collision_radius_px": 8,
    "lifetime_frames": 600,
    "spawn_warning_frames": 30,
    "attack_warning_frames": 30,
    "final_explosion_warning_frames": 35,
    "reward_eligible": false,
    "capabilities": [],
    "attack": {
      "kind": "projectile_volley",
      "range_px": 144,
      "active_frames": 6,
      "recovery_frames": 20,
      "cooldown_frames": 120
    }
  },
  {
    "category": "summon_definition",
    "id": "timeline_echo",
    "schema_version": 1,
    "name_key": "SUMMON_TIMELINE_ECHO_NAME",
    "description_key": "SUMMON_TIMELINE_ECHO_DESC",
    "availability": [
      "LAUNCH",
      "EXPANSION"
    ],
    "tags": [
      "summon",
      "nonrecursive"
    ],
    "compatibility": {
      "floor_ids": [
        "floor_ruins_of_remnant",
        "floor_void_forest",
        "floor_time_rift",
        "floor_plane_forge",
        "floor_throne_of_void"
      ],
      "actor_kinds": [
        "summon"
      ]
    },
    "references": [
      "time_sovereign"
    ],
    "runtime_kind": "timeline_echo",
    "parent_definition_id": "time_sovereign",
    "max_hp": 200,
    "hp_fraction": 0,
    "damage": 15,
    "damage_multiplier": 1,
    "move_speed": 112,
    "collision_radius_px": 12,
    "lifetime_frames": 1200,
    "spawn_warning_frames": 30,
    "attack_warning_frames": 30,
    "final_explosion_warning_frames": 35,
    "reward_eligible": false,
    "capabilities": [],
    "attack": {
      "kind": "melee",
      "range_px": 48,
      "active_frames": 6,
      "recovery_frames": 20,
      "cooldown_frames": 120
    }
  },
  {
    "category": "summon_definition",
    "id": "void_sapling",
    "schema_version": 1,
    "name_key": "SUMMON_VOID_SAPLING_NAME",
    "description_key": "SUMMON_VOID_SAPLING_DESC",
    "availability": [
      "LAUNCH",
      "EXPANSION"
    ],
    "tags": [
      "summon",
      "nonrecursive"
    ],
    "compatibility": {
      "floor_ids": [
        "floor_ruins_of_remnant",
        "floor_void_forest",
        "floor_time_rift",
        "floor_plane_forge",
        "floor_throne_of_void"
      ],
      "actor_kinds": [
        "summon"
      ]
    },
    "references": [
      "forest_caller"
    ],
    "runtime_kind": "void_sapling",
    "parent_definition_id": "forest_caller",
    "max_hp": 60,
    "hp_fraction": 0,
    "damage": 15,
    "damage_multiplier": 1,
    "move_speed": 58,
    "collision_radius_px": 9,
    "lifetime_frames": 900,
    "spawn_warning_frames": 30,
    "attack_warning_frames": 30,
    "final_explosion_warning_frames": 35,
    "reward_eligible": false,
    "capabilities": [],
    "attack": {
      "kind": "melee",
      "range_px": 32,
      "active_frames": 6,
      "recovery_frames": 20,
      "cooldown_frames": 120
    }
  },
  {
    "category": "summon_definition",
    "id": "elite_mirror",
    "schema_version": 1,
    "name_key": "SUMMON_ELITE_MIRROR_NAME",
    "description_key": "SUMMON_ELITE_MIRROR_DESC",
    "availability": [
      "LAUNCH",
      "EXPANSION"
    ],
    "tags": [
      "summon",
      "nonrecursive"
    ],
    "compatibility": {
      "floor_ids": [
        "floor_ruins_of_remnant",
        "floor_void_forest",
        "floor_time_rift",
        "floor_plane_forge",
        "floor_throne_of_void"
      ],